{
  "$schema": "https://json-schema.org/draft/2020-12/schema",
  "type": "object",
  "properties": {
    "apiVersion": {
      "type": "string",
      "const": "kernel-zero.dev/v1"
    },
    "kind": {
      "type": "string",
      "const": "RepositoryPolicy"
    },
    "metadata": {
      "type": "object",
      "properties": {
        "name": {
          "type": "string",
          "minLength": 3,
          "maxLength": 64,
          "pattern": "^[a-z0-9]+(?:-[a-z0-9]+)*$"
        },
        "revision": {
          "type": "integer",
          "minimum": 1,
          "maximum": 9007199254740991
        },
        "description": {
          "type": "string",
          "minLength": 1,
          "maxLength": 500
        }
      },
      "required": [
        "name",
        "revision",
        "description"
      ],
      "additionalProperties": false
    },
    "scope": {
      "type": "object",
      "properties": {
        "languages": {
          "minItems": 1,
          "maxItems": 2,
          "type": "array",
          "items": {
            "$ref": "#/$defs/__schema0"
          }
        },
        "include": {
          "$ref": "#/$defs/__schema1"
        },
        "exclude": {
          "$ref": "#/$defs/__schema3"
        }
      },
      "required": [
        "languages",
        "include",
        "exclude"
      ],
      "additionalProperties": false
    },
    "rules": {
      "minItems": 1,
      "maxItems": 500,
      "type": "array",
      "items": {
        "$ref": "#/$defs/__schema4"
      }
    }
  },
  "required": [
    "apiVersion",
    "kind",
    "metadata",
    "scope",
    "rules"
  ],
  "additionalProperties": false,
  "$defs": {
    "__schema0": {
      "type": "string",
      "enum": [
        "typescript",
        "tsx"
      ]
    },
    "__schema1": {
      "minItems": 1,
      "maxItems": 100,
      "type": "array",
      "items": {
        "$ref": "#/$defs/__schema2"
      }
    },
    "__schema2": {
      "type": "string",
      "minLength": 1,
      "maxLength": 500
    },
    "__schema3": {
      "minItems": 0,
      "maxItems": 100,
      "type": "array",
      "items": {
        "$ref": "#/$defs/__schema2"
      }
    },
    "__schema4": {
      "type": "object",
      "properties": {
        "id": {
          "type": "string",
          "minLength": 3,
          "maxLength": 80,
          "pattern": "^[a-z0-9]+(?:-[a-z0-9]+)*$"
        },
        "title": {
          "type": "string",
          "minLength": 1,
          "maxLength": 120
        },
        "level": {
          "type": "string",
          "enum": [
            "error",
            "warning"
          ]
        },
        "check": {
          "oneOf": [
            {
              "type": "object",
              "properties": {
                "kind": {
                  "type": "string",
                  "const": "forbid-import-edge"
                },
                "from": {
                  "$ref": "#/$defs/__schema1"
                },
                "deny": {
                  "minItems": 1,
                  "maxItems": 100,
                  "type": "array",
                  "items": {
                    "$ref": "#/$defs/__schema5"
                  }
                }
              },
              "required": [
                "kind",
                "from",
                "deny"
              ],
              "additionalProperties": false
            },
            {
              "type": "object",
              "properties": {
                "kind": {
                  "type": "string",
                  "const": "require-import"
                },
                "files": {
                  "$ref": "#/$defs/__schema1"
                },
                "module": {
                  "$ref": "#/$defs/__schema6"
                },
                "allowTypeOnly": {
                  "default": false,
                  "type": "boolean"
                }
              },
              "required": [
                "kind",
                "files",
                "module"
              ],
              "additionalProperties": false
            },
            {
              "type": "object",
              "properties": {
                "kind": {
                  "type": "string",
                  "const": "restrict-call-site"
                },
                "callee": {
                  "$ref": "#/$defs/__schema7"
                },
                "allowFrom": {
                  "$ref": "#/$defs/__schema1"
                },
                "requireResolution": {
                  "default": true,
                  "type": "boolean"
                }
              },
              "required": [
                "kind",
                "callee",
                "allowFrom"
              ],
              "additionalProperties": false
            },
            {
              "type": "object",
              "properties": {
                "kind": {
                  "type": "string",
                  "const": "require-export-keys"
                },
                "files": {
                  "$ref": "#/$defs/__schema1"
                },
                "exportName": {
                  "$ref": "#/$defs/__schema6"
                },
                "requiredKeys": {
                  "$ref": "#/$defs/__schema7"
                }
              },
              "required": [
                "kind",
                "files",
                "exportName",
                "requiredKeys"
              ],
              "additionalProperties": false
            },
            {
              "type": "object",
              "properties": {
                "kind": {
                  "type": "string",
                  "const": "require-tenant-parameter"
                },
                "files": {
                  "$ref": "#/$defs/__schema1"
                },
                "symbols": {
                  "$ref": "#/$defs/__schema6"
                },
                "parameter": {
                  "default": "workspaceId",
                  "$ref": "#/$defs/__schema6"
                }
              },
              "required": [
                "kind",
                "files",
                "symbols"
              ],
              "additionalProperties": false
            },
            {
              "type": "object",
              "properties": {
                "kind": {
                  "type": "string",
                  "const": "require-boundary-parse"
                },
                "files": {
                  "$ref": "#/$defs/__schema1"
                },
                "boundaryCalls": {
                  "$ref": "#/$defs/__schema7"
                },
                "parserCalls": {
                  "$ref": "#/$defs/__schema7"
                }
              },
              "required": [
                "kind",
                "files",
                "boundaryCalls",
                "parserCalls"
              ],
              "additionalProperties": false
            },
            {
              "type": "object",
              "properties": {
                "kind": {
                  "type": "string",
                  "const": "require-governed-operation"
                },
                "files": {
                  "$ref": "#/$defs/__schema1"
                },
                "registryExport": {
                  "$ref": "#/$defs/__schema6"
                },
                "requiredKeys": {
                  "minItems": 5,
                  "maxItems": 5,
                  "type": "array",
                  "items": {
                    "$ref": "#/$defs/__schema8"
                  }
                },
                "declarationCalls": {
                  "default": [
                    "defineGovernedAction"
                  ],
                  "$ref": "#/$defs/__schema7"
                }
              },
              "required": [
                "kind",
                "files",
                "registryExport",
                "requiredKeys"
              ],
              "additionalProperties": false
            },
            {
              "type": "object",
              "properties": {
                "kind": {
                  "type": "string",
                  "const": "require-context-parameter"
                },
                "files": {
                  "$ref": "#/$defs/__schema1"
                },
                "symbols": {
                  "$ref": "#/$defs/__schema6"
                },
                "parameter": {
                  "$ref": "#/$defs/__schema6"
                },
                "expectedType": {
                  "default": null,
                  "anyOf": [
                    {
                      "oneOf": [
                        {
                          "type": "object",
                          "properties": {
                            "kind": {
                              "type": "string",
                              "const": "intrinsic"
                            },
                            "name": {
                              "type": "string",
                              "enum": [
                                "string",
                                "number",
                                "boolean",
                                "bigint"
                              ]
                            }
                          },
                          "required": [
                            "kind",
                            "name"
                          ],
                          "additionalProperties": false
                        },
                        {
                          "type": "object",
                          "properties": {
                            "kind": {
                              "type": "string",
                              "const": "export"
                            },
                            "file": {
                              "$ref": "#/$defs/__schema9"
                            },
                            "exportName": {
                              "$ref": "#/$defs/__schema10"
                            }
                          },
                          "required": [
                            "kind",
                            "file",
                            "exportName"
                          ],
                          "additionalProperties": false
                        }
                      ]
                    },
                    {
                      "type": "null"
                    }
                  ]
                }
              },
              "required": [
                "kind",
                "files",
                "symbols",
                "parameter"
              ],
              "additionalProperties": false
            },
            {
              "type": "object",
              "properties": {
                "kind": {
                  "type": "string",
                  "const": "require-closed-registry"
                },
                "registryFile": {
                  "$ref": "#/$defs/__schema9"
                },
                "registryExport": {
                  "$ref": "#/$defs/__schema10"
                },
                "declarationFiles": {
                  "$ref": "#/$defs/__schema1"
                },
                "declarationCalls": {
                  "$ref": "#/$defs/__schema7"
                },
                "requiredKeys": {
                  "minItems": 0,
                  "maxItems": 100,
                  "type": "array",
                  "items": {
                    "$ref": "#/$defs/__schema6"
                  }
                }
              },
              "required": [
                "kind",
                "registryFile",
                "registryExport",
                "declarationFiles",
                "declarationCalls",
                "requiredKeys"
              ],
              "additionalProperties": false
            },
            {
              "type": "object",
              "properties": {
                "kind": {
                  "type": "string",
                  "const": "restrict-property-write"
                },
                "files": {
                  "$ref": "#/$defs/__schema1"
                },
                "targetType": {
                  "type": "object",
                  "properties": {
                    "file": {
                      "$ref": "#/$defs/__schema9"
                    },
                    "exportName": {
                      "$ref": "#/$defs/__schema10"
                    }
                  },
                  "required": [
                    "file",
                    "exportName"
                  ],
                  "additionalProperties": false
                },
                "property": {
                  "$ref": "#/$defs/__schema10"
                },
                "allowFrom": {
                  "$ref": "#/$defs/__schema3"
                }
              },
              "required": [
                "kind",
                "files",
                "targetType",
                "property",
                "allowFrom"
              ],
              "additionalProperties": false
            }
          ]
        },
        "remediation": {
          "type": "string",
          "minLength": 1,
          "maxLength": 500
        }
      },
      "required": [
        "id",
        "title",
        "level",
        "check",
        "remediation"
      ],
      "additionalProperties": false
    },
    "__schema5": {
      "type": "string",
      "minLength": 6,
      "maxLength": 500
    },
    "__schema6": {
      "type": "string",
      "minLength": 1,
      "maxLength": 500
    },
    "__schema7": {
      "minItems": 1,
      "maxItems": 100,
      "type": "array",
      "items": {
        "$ref": "#/$defs/__schema6"
      }
    },
    "__schema8": {
      "type": "string",
      "enum": [
        "capability",
        "tenantScope",
        "quota",
        "audit",
        "idempotency"
      ]
    },
    "__schema9": {
      "$ref": "#/$defs/__schema2"
    },
    "__schema10": {
      "type": "string",
      "minLength": 1,
      "maxLength": 200,
      "pattern": "^[A-Za-z_$][\\w$]*$"
    }
  }
}
