{"apiVersion":"kernel-zero.dev/v1","kind":"RepositoryPolicy","metadata":{"description":"Repository architecture rules","name":"service-boundaries","revision":1},"rules":[{"check":{"deny":["module:@kernel-zero/persistence","module:@prisma/client"],"from":["apps/control/**"],"kind":"forbid-import-edge"},"id":"layers-no-ui-db","level":"error","remediation":"Call an application service through a validated boundary.","title":"UI cannot import persistence"}],"scope":{"exclude":["**/*.generated.ts","**/fixtures/**"],"include":["apps/**/*.ts","apps/**/*.tsx","packages/**/*.ts"],"languages":["typescript","tsx"]}}
